{
  "id": "cad-l-bracket",
  "name": "CAD L-Bracket",
  "description": "A simple L-bracket authored by the CAD kernel pipeline (extrude only, no sketch UI yet) -- proves a real replicad/OpenCascade solid becomes a real robot-def body. See docs/decisions/cad-kernel-foundation.md.",
  "root_placement": {
    "position": [
      0,
      0,
      0
    ],
    "rotation_rpy": [
      0,
      0,
      0
    ]
  },
  "bodies": [
    {
      "id": "base",
      "name": "Base Slab",
      "transform": {
        "position": [
          0,
          0,
          0
        ],
        "rotation_rpy": [
          0,
          0,
          0
        ]
      },
      "visual": {
        "type": "cad_mesh",
        "vertices": [
          -0.03999999910593033,
          -0.02500000037252903,
          0,
          -0.03999999910593033,
          -0.02500000037252903,
          0.009999999776482582,
          0.03999999910593033,
          -0.02500000037252903,
          0.009999999776482582,
          0.03999999910593033,
          -0.02500000037252903,
          0,
          0.03999999910593033,
          -0.02500000037252903,
          0,
          0.03999999910593033,
          -0.02500000037252903,
          0.009999999776482582,
          0.03999999910593033,
          0.02500000037252903,
          0.009999999776482582,
          0.03999999910593033,
          0.02500000037252903,
          0,
          0.03999999910593033,
          0.02500000037252903,
          0,
          0.03999999910593033,
          0.02500000037252903,
          0.009999999776482582,
          -0.03999999910593033,
          0.02500000037252903,
          0.009999999776482582,
          -0.03999999910593033,
          0.02500000037252903,
          0,
          -0.03999999910593033,
          0.02500000037252903,
          0,
          -0.03999999910593033,
          0.02500000037252903,
          0.009999999776482582,
          -0.03999999910593033,
          -0.02500000037252903,
          0.009999999776482582,
          -0.03999999910593033,
          -0.02500000037252903,
          0,
          -0.03999999910593033,
          -0.02500000037252903,
          0,
          0.03999999910593033,
          -0.02500000037252903,
          0,
          0.03999999910593033,
          0.02500000037252903,
          0,
          -0.03999999910593033,
          0.02500000037252903,
          0,
          -0.03999999910593033,
          -0.02500000037252903,
          0.009999999776482582,
          0.03999999910593033,
          -0.02500000037252903,
          0.009999999776482582,
          0.03999999910593033,
          0.02500000037252903,
          0.009999999776482582,
          -0.03999999910593033,
          0.02500000037252903,
          0.009999999776482582
        ],
        "faces": [
          3,
          1,
          0,
          3,
          2,
          1,
          7,
          5,
          4,
          7,
          6,
          5,
          11,
          9,
          8,
          11,
          10,
          9,
          15,
          13,
          12,
          15,
          14,
          13,
          18,
          17,
          16,
          18,
          16,
          19,
          22,
          20,
          21,
          22,
          23,
          20
        ]
      },
      "collision": {
        "type": "cad_mesh",
        "vertices": [
          -0.03999999910593033,
          -0.02500000037252903,
          0,
          -0.03999999910593033,
          -0.02500000037252903,
          0.009999999776482582,
          0.03999999910593033,
          -0.02500000037252903,
          0.009999999776482582,
          0.03999999910593033,
          -0.02500000037252903,
          0,
          0.03999999910593033,
          -0.02500000037252903,
          0,
          0.03999999910593033,
          -0.02500000037252903,
          0.009999999776482582,
          0.03999999910593033,
          0.02500000037252903,
          0.009999999776482582,
          0.03999999910593033,
          0.02500000037252903,
          0,
          0.03999999910593033,
          0.02500000037252903,
          0,
          0.03999999910593033,
          0.02500000037252903,
          0.009999999776482582,
          -0.03999999910593033,
          0.02500000037252903,
          0.009999999776482582,
          -0.03999999910593033,
          0.02500000037252903,
          0,
          -0.03999999910593033,
          0.02500000037252903,
          0,
          -0.03999999910593033,
          0.02500000037252903,
          0.009999999776482582,
          -0.03999999910593033,
          -0.02500000037252903,
          0.009999999776482582,
          -0.03999999910593033,
          -0.02500000037252903,
          0,
          -0.03999999910593033,
          -0.02500000037252903,
          0,
          0.03999999910593033,
          -0.02500000037252903,
          0,
          0.03999999910593033,
          0.02500000037252903,
          0,
          -0.03999999910593033,
          0.02500000037252903,
          0,
          -0.03999999910593033,
          -0.02500000037252903,
          0.009999999776482582,
          0.03999999910593033,
          -0.02500000037252903,
          0.009999999776482582,
          0.03999999910593033,
          0.02500000037252903,
          0.009999999776482582,
          -0.03999999910593033,
          0.02500000037252903,
          0.009999999776482582
        ],
        "faces": [
          3,
          1,
          0,
          3,
          2,
          1,
          7,
          5,
          4,
          7,
          6,
          5,
          11,
          9,
          8,
          11,
          10,
          9,
          15,
          13,
          12,
          15,
          14,
          13,
          18,
          17,
          16,
          18,
          16,
          19,
          22,
          20,
          21,
          22,
          23,
          20
        ]
      },
      "mass": 0.05,
      "inertia": {
        "ixx": 0.0001,
        "iyy": 0.0001,
        "izz": 0.0001
      }
    },
    {
      "id": "upright",
      "name": "Upright Slab",
      "transform": {
        "position": [
          -0.035,
          0,
          0.045
        ],
        "rotation_rpy": [
          0,
          0,
          0
        ]
      },
      "visual": {
        "type": "cad_mesh",
        "vertices": [
          -0.004999999888241291,
          -0.02500000037252903,
          0,
          -0.004999999888241291,
          -0.02500000037252903,
          0.07999999821186066,
          0.004999999888241291,
          -0.02500000037252903,
          0.07999999821186066,
          0.004999999888241291,
          -0.02500000037252903,
          0,
          0.004999999888241291,
          -0.02500000037252903,
          0,
          0.004999999888241291,
          -0.02500000037252903,
          0.07999999821186066,
          0.004999999888241291,
          0.02500000037252903,
          0.07999999821186066,
          0.004999999888241291,
          0.02500000037252903,
          0,
          0.004999999888241291,
          0.02500000037252903,
          0,
          0.004999999888241291,
          0.02500000037252903,
          0.07999999821186066,
          -0.004999999888241291,
          0.02500000037252903,
          0.07999999821186066,
          -0.004999999888241291,
          0.02500000037252903,
          0,
          -0.004999999888241291,
          0.02500000037252903,
          0,
          -0.004999999888241291,
          0.02500000037252903,
          0.07999999821186066,
          -0.004999999888241291,
          -0.02500000037252903,
          0.07999999821186066,
          -0.004999999888241291,
          -0.02500000037252903,
          0,
          -0.004999999888241291,
          -0.02500000037252903,
          0,
          0.004999999888241291,
          -0.02500000037252903,
          0,
          0.004999999888241291,
          0.02500000037252903,
          0,
          -0.004999999888241291,
          0.02500000037252903,
          0,
          -0.004999999888241291,
          -0.02500000037252903,
          0.07999999821186066,
          0.004999999888241291,
          -0.02500000037252903,
          0.07999999821186066,
          0.004999999888241291,
          0.02500000037252903,
          0.07999999821186066,
          -0.004999999888241291,
          0.02500000037252903,
          0.07999999821186066
        ],
        "faces": [
          3,
          1,
          0,
          3,
          2,
          1,
          7,
          5,
          4,
          7,
          6,
          5,
          11,
          9,
          8,
          11,
          10,
          9,
          15,
          13,
          12,
          15,
          14,
          13,
          18,
          17,
          16,
          18,
          16,
          19,
          22,
          20,
          21,
          22,
          23,
          20
        ]
      },
      "collision": {
        "type": "cad_mesh",
        "vertices": [
          -0.004999999888241291,
          -0.02500000037252903,
          0,
          -0.004999999888241291,
          -0.02500000037252903,
          0.07999999821186066,
          0.004999999888241291,
          -0.02500000037252903,
          0.07999999821186066,
          0.004999999888241291,
          -0.02500000037252903,
          0,
          0.004999999888241291,
          -0.02500000037252903,
          0,
          0.004999999888241291,
          -0.02500000037252903,
          0.07999999821186066,
          0.004999999888241291,
          0.02500000037252903,
          0.07999999821186066,
          0.004999999888241291,
          0.02500000037252903,
          0,
          0.004999999888241291,
          0.02500000037252903,
          0,
          0.004999999888241291,
          0.02500000037252903,
          0.07999999821186066,
          -0.004999999888241291,
          0.02500000037252903,